"score","city","title","review"
"4","Troy","Great CD","My lovely Pat has one of the GREAT voices of her generation. I have listened to this CD for YEARS and I still LOVE IT. When I'm in a good mood it makes me feel better. A bad mood just evaporates like sugar in the rain. This CD just oozes LIFE. Vocals are jusat STUUNNING and lyrics just kill. One of life's hidden gems. This is a desert isle CD in my book. Why she never made it big is just beyond me. Everytime I play this"
"4","Mount Lebanon","One of the best game music soundtracks - for a game I didn't really play","Despite the fact that I have only played a small portion of the game"
"2","Hemet","Batteries died within a year ...","I bought this charger in Jul 2003 and it worked OK for a while. The design is nice and convenient. However"
"5","Liberty","works fine"," but Maha Energy is better"
"5","Jupiter","Great for the non-audiophile","Reviewed quite a bit of the combo players and was hesitant due to unfavorable reviews and size of machines. I am weaning off my VHS collection"
"2","Paris","DVD Player crapped out after one year","I also began having the incorrect disc problems that I've read about on here. The VCR still works"
"1","College Place","Incorrect Disc","I love the style of this"
"2","Merrill","DVD menu select problems","I cannot scroll through a DVD menu that is set up vertically. The triangle keys will only select horizontally. So I cannot select anything on most DVD's besides play. No special features"
"3","Bel Air South","Unique Weird Orientalia from the 1930's","Exotic tales of the Orient from the 1930's. Dr Shen Fu"
"1","Toms River","Not an ultimate guide","Firstly"
"4","Chino Hills","Great book for travelling Europe","I currently live in Europe"
"2","Center Point","Not!","If you want to listen to El Duke "
"2","Beaver Falls","A complete Bust","This game requires quicktime 5.0 to work...if you have a better version of quicktime (I have 7.5)"
"4","Browns Mills","TRULY MADE A DIFFERENCE!","I have been using this product for a couple years now. I started using it because my hair had gotten so dry from all the chemical treatments and relaxers. This actualy came in the relaxer kit. I tried it and could not beleive the difference it made with one use. I could not find it in any of the stores at the time so I searched Amazon and they had it. I absolutely love it. It is the best moisturizing product I have used so far. My hair is soft with good elasticity and it is not breaking anywhere close to what it was. I am very happy with it."
"3","Mission Viejo","didn't run off of USB bus power","Was hoping that this drive would run off of bus power"
"2","Richmond Heights","Don't buy!","First of all"
"5","Roanoke","Simple"," Durable"
"4","Indianola","Review of Kelly Club for Toddlers","For the price of 7.99"
"5","Greece","SOY UN APASIONADO DEL BOX","Y ESTE LIBRO ESTÁ ESPLÉNDIDO !Lo disfrutas"
"5","Stoughton","Some of the best fiddle playing I have heard in a long time","This is an excellent album with some great fiddle playing. Ryan is amazing to watch when he plays in person. You can feel the emotion he puts into each song."
"2","Tifton","Long and boring","I've read this book with much expectation"
"2","Greenwood","Dont like it","This product smells when you open the package and it appears one of the gel cushions leaks so I spent $10 and havent worn then. I wouldnt buy this product again. Dont waste your money on something you may not be able to use."
"3","Cocoa Beach","one of the last in the series to collect !","The magazine was in very good condition and had the usual high standard of articles and photos that Victoria magazine has come to represent. I have collected all the previous magazines of the series and still enjoy leafing through them on a rainy day"
"3","Picayune","Sony Hi8 Camcorder with 2.5 LCD","I believe I will be very happy with the camcorder. Its small"
"2","Tredyffrin","Don't Take the Chance - Get the SE Branded Cable","If you purchase this data cable"
"2","Kirksville","Waste of money!","Like many of the Barbie CD Roms"
"5","Sharonville","works great","i bought this item to connect to a strobe light. unit functions well. not sure that it has all the range claimed"
"2","Monroe","Has No Range","I suppose if you were going to sit in the same room and have line-of-sight with the device"
"4","Cherry Hill Mall","wish i had gotten this sooner!","ive got a lamp in the corner of my room behind my desk thats a complete pain in the arse to turn on and off. ive been using this with the lamp for a month now and it works perfectly. added a little velcro and now i have a light switch where ever i want. under my desk"
"2","Yulee","Three Days of Use and It Broke","Very disappointed in this product. It worked perfectly for exactly three days and could not be resuscitated. It was very inexpensive so I did not want to pay half again the price to ship it back for an exchange"
"4","Manhattan","This is the all time best book!","This is the all time best book. She mentoins in the book how anyone can be a vampire"
"5","Coal","Mary Ash","Can't believe I have never reviewed this book before. First read this back when I was 13. Like a lot of girls wanting the mysterious boyfriend and believed in soul-mates which drug me into these books. Rereading it over time years later still stands the test of time for me. Ash is that bad boy you want and your parents want you to stay away from even though he seems like a jerk there is just something about him that make you wanna root for him."
"4","Boone","Tha BOMB of a book!!","L.J. Smith is the best author in the whole world. I read this book a year ago but I can't stop reading it. It is beyond sweet. I love Ash.The entire Night World seris is the bomb. I read mostly everyone of L.J Smiths book and they all are awesome. I think Ash and Mary Lynetee are one of the sweetest soulmates. I loved how they tried to fight there feelings but couldn't. There should be real guys like Ash"
"4","Purcellville","This book was a great book that i have read many times!","This book was so great! I loved and read it so many times that i will soon have to buy a new copy because my last one fell apart. I just hope that there is a follow up on this story because I want to know if Mary-Lynette and Ash get together."
"3","Hartford","They'd watch it nonstop if I'd let them","apart from it arriving broken the first time"
"2","Kannapolis","Not as expected...","My children get easily bored with this video. I thought it was several episodes of Thomas but it has A LOT of just children and parents talking about Thomas and all. It doesn't keep the kids attention because what kid wants to sit and listen to a bunch of talking. This was my first Thomas video purchase...hopefully the next will have more shows and less talking!"
"4","Arlington","Wonderful","I went online for information about Dockers Khaki pants. The size my husband wears are very hard to find in stores. I was very impressed with the selection I had and he was thrilled to have all these pants without having them taken up in the length. The delivery was quick (especially during Christmas) and I really appreciate all the effort made to send us the selections we chose."
"2","Hernando","Doublecharged for shipping because merchant was backordered","Merchant was out of stock on the second pair of pants"
"4","North Fayette","Book of Chance","I had just finished reading 'The Food of Love' by Anthony Capella since I had nothing to do"
"2","Norton","Light reading"," light in substance"
"4","Ridgefield Park","WeiB FOREVER!","This is a great CD!! I love WeiB Kreuz!! The anime is awsome! Its bout 4 guys (hhhooottt) who work at a flower shop"
"2","Indian Trail","Great Book--unacceptable condition","I was looking forward to receiving this book"
"3","Pine Ridge","Real HTML for people who build sites for a living","This book is simply great! If you build sites for a living you probably struggle with books that trivialize HTML and present its syntax willy-nilly. This book is the ONLY book I've ever seen that actually seems to be written by someone who builds sites professionally and wants to know all the markup. It explains logical and physical tagging styles well and does a really good job showing how to hook HTML with other technologies without trying to teach CGI"
"4","Gardner","Marriage has its good and bad moments","This is a tear-jerker mixed with humor. A lot of rough patches for this couple but don't let that scare you off because there are also a lot of good times"
"3","Muskego","Amazing...","love it...very touch.it's to bad that in the dvd description doesn't mention no subtitles"
"4","Vestal","Leslie in a nutshell","Danelectro DJ-20C Rocky Road Spin Speaker Mini Effects Pedal"
"3","Red Oak","More Romance Please and Less Mystery!!","the reason i gave two stars when I usually give 5 stars for ms. feehan's books is b/c this book was tooooooo mystery/gothic genre rather than romance. I really didn't feel like the two main characters were in love"
"2","San Pablo","A Lost Author","I have read all of the Carpathian novels to date"
"1","Yorktown","Okay but Messy....","We purchased this bag for a vacation we were taking a cruise and we wanted to use it when we left the ship. The bag was convenient to carry"
"5","Liberty Triangle","Patricia Cornwell has turned me into a reader","I was never really a big reader before and somebody put me on to Patricia Cornwell. Well"
"4","Moraga","Best of the First Four in this series.","This is an awesome book. Kay just keeps getting better and better. It's also fun to see the characters develop more with each book - Kay herself as she seems to be always one against the world"
"5","Raymore","Great Beginning...poor ending","Parricia Corwell"
"2","Walla Walla","12 Y/O Potty Humor From 40 somethings does not a comedy make....","Saw this movie and felt compelled to warn people not to waste 144 agonizing minutes of their lives. In a nutshell"
"2","East Stroudsburg","I wish Adam Sandler wasn't in this.","I should have known going into this movie having Judd Apatow a part of it would mean I would hate it. However"
"4","Orange City","Wonderful"," baffling mix"
"4","Sweetwater","No another grill like this...","This grill is one of its kind...It can be use anywhere without so much hard work..it fits snugly anywhere...."
"3","Broadview Park","Disappointment at it's extreme","I had never read this author"
"3","San Jose","From Potter's Field by Patricia Cornwell.","This was a very good book with excellent descriptions. It's a real page turner and keeps you wondering what's going to happen next. The best parts are at the very beggining and the end."
"4","Storm Lake","An Engrossing and Chilling Read","My first foray into the novels of Patricia Cornwell has left me impressed. The characters were intense and realistic. My only concern is that the evil Temple Gault at the end of the novel is as vague as he was in the beginning. Why did he decide to trail and give gifts to Dr. Scarpetta? Needless to say"
"3","Huntersville","great book. i loved it! they mentioned a movie"," where is it?"
"4","Hamilton","Simply Awesome!","This was only my first Cornwell novel and I'm hooked! In the past few months I have managed to collect all of her books and I can't wait to dive into them! This summer will be a suspensful one for Scarpetta and I."
"3","Stroud","Predictable & has a lame ending","I have read all of the Scarpetta novels & this is not the worst (that would be Cause of Death) but rt. up there. I thought the story began well enough"
"4","Petal","Black Knight C2C Heat Squash Racquet","Great racquet! But I'm a power hitter I have no power Generating Difficulty With This racquet. My style is to try to volleyball and everything I've found this racquet to well balanced and maneuvered. I like the factory grip although with distinct ridges Others prefer a smooth grip May - give the factory grip on chance and you May Come to like it. The sale prices are right for a high About end racquet"
"2","Hopewell","A historical gem whose title obscures its intent","Started laughing in the second chapter....enjoyed the book after I realized that I wasn't going to learn anything new. It's obviously a miracle that we survived for the 65 years since it was first published.And seeing that the pending insolvency of the US was as loudly shouted in the 40's as it is now was worth the price. This book had quotes that would shame both modern day political extremes in the US.Kudos to whoever owns the copyright --- now there's economics in action."
"1","East Providence","Vastly overrated work of fiction","I was sorely disappointed in this vapid and smarmy demogoguery. Sure"
"3","New Richmond","sergeant frosts lonely hearts club band","edith has created a venue for herself to exorcise melancholic memories with painful melodies. there are no disguises on this collection. lonesome guitars and medicinal piano radiate the mood of broken spirits. she writes all her own songs. these ballads are definite reminders of those unbearable moments we all have to live. they are all gray sky"
"4","Superior","Great Camera","I recently purchased this camera and I'm very satisfied with it. I find the quality of the pictures with this camera as good if not better than anything else without going to digital. It is very comfortable to hold and the controls are easy to use. I highly reccomend this product to anyone looking for a top quality camera at an affordable price. Nice going Sony!"
"2","Wall","Had to return it","The sizing is perfect and a medium fits just right. I am 5'2 size 4 137 lbs before baby and i gained about 35 lbs during pregnancy"
"1","Paducah","Broke the 2nd time I wore it"," great until then"
"3","Troy","The amazing squeem","I love love love the squeem!!! The before and after pictures are definitely real!!! You can immediately tell the difference when you put it on it definitely improves your posture"
"4","Napa","Great Product","A friend recommended this product to flatten the tummy for great look in a dress. I brought a medium according to the measurement guide lines but I needed a small. It was extremely difficult to put on so I needed assistance. Once it was on I was still able to contract my core"
"4","Waukesha","I recommend ordering a size or 2 larger than your regular size.","I ordered the Squeem waist shaper in a size small...my general size is 4-6"
"2","Lansdowne","WASTE OF MONEY: The inner metal rods keep poking through","The squeem is a great idea but the construction is not the best. While the product compresses your stomach"
"3","Celina","CAUSES BRUISING AND BLISTERS IF WORN TOO LONG","I ordered this product to slim down my stomach. I was looking for something I could wear all day with my jeans as well as underneath my dresses. I wore the squeem to work occasionally and then I would take it off when I got home. When I would take it off"
"1","Bethel Park","Not happy","I was really unhappy with this. I followed what others said and ordered based on my prepregnancy size. It was WAY too small at 7 weeks post-pardum. I'm ten weeks post-pardum and may try it again but it was a real self-esteem crusher initially. I'm a size 0 pre-pregnancy and so I thought it was fair to order the XS but I guess not."
"2","El Segundo","nice product","My wife loves it but we unfortunately perchaced the wrong size. She made a coment about the sizing chart being in dress sizes and she picked the size she is and we received it and the apparel was way too small. We have been meaning to exchange it but its tough to get time being as we have new born twins. That's why she wanted the apparel. She was really excited to receive the part and was disappointed when it didn't fit."
"5","Mendota","Does the job","I have been looking for something to hold in my stomach that wasn't elastic based. Found this item and have to say I am pretty pleased. The hooks do take a while"
"1","Keystone","conspiracy theorist","The author is very likely a Kurdish nationalist"
"2","San Mateo","Another disappointment from Higgins","This novella (stretched to 271 pages by wide margins and double-spaced lines) reads like a screenplay treatment. There is very little character development"
"3","Rolesville","1"," and thats being generous...."
"5","East Lampeter","Good matt nude lipstick","It's got a nice warm scent of vanilla-like smell. Texture is creamy. Meadow Sweet is a nice nude color. Can't apply too much or else it'll look a bit dry."
"5","Brighton","I would sell it -- book complete with dust cover. Excellent","West is only fairly judged by the breadth of his work. He has a special view of human nature and all its weaknesses."
"3","East Peoria","A welcomed change from the frozen plains of Europe","A refreshing"
"1","Schenectady","where does the Novel begin?","I found it preachy and long and got.very bored to claw my way through the very wordy prologue.Then tried to find the.actual novelFinally gave up!!!"
"3","Lakeland","Avoid it.","The abridged version of this book would read as so:Sin is inevitable. So make the best of bad situations. And oh by the way... women are strong.There ya go. Nuff said. I don't need to read obnoxiously long sentences lamenting on one sentiment for the entire 160 odd pages or so of this travesty. The entire book is just one big complaint. From the girl who commits adultery. She laments about it for the whole stinking book and puts up with some obnoxious kid the for whole thing as well. Painfully thick language"
"3","Angola","ok...","this book was recommend 2 me from my neighbor. but i dont think that dis is dat gud of a book 2 recommend... i didnt like it 2 much but..."
"4","West Linn","The Scarlet Letter","I really enjoyed this book. It shows the judgmental tendencies in our human race and how one woman strove to live a life of service to others to gain redemption for her mistake. Can't go wrong with the classics."
"1","Greenville","This edition is not complete","This review refers to ISBN 978-1613823613. With no explanation or indication that it is doing so"
"4","West Goshen","Creepy","The creepiest book I've ever read! It's a creepy mystery/romance all in one creepy book! I would read it again lol"
"2","Glenpool","A book for those with time on their hands","If this book is so great"
"1","Pontiac","Painful","This book has to be one of the most tedious works of literature ever written. Hawthorne is a great writer"
"4","College Station","Great novel","The Scarlet Letter by Nathaniel Hawthorne is a great novel. It takes place in Boston"
"2","South Daytona","Horrible reader","i couldn't listen to this book because the women reading it has such a screechy horrible voice so i can give no review of the actual book but whatever you do try to find a version with a different reader if you're into audio books"
"2","Winchester","Mistake?","I ordered the Penguin edition for this book five weeks before my grad class started. It was very important to have the correct edition for proper pagination. I PAID for the Penguin edition. I GOT the $2 Dover Thrift edition three weeks later. When I called the distributor"
"4","Haledon","The Scarlet Letter","Much to my amazement"
"4","Red Hook","The Scarlet Letter a must read for any American","The best book that I have ever been assigned to read for school by far. The way in which Hawthorne captures the shame that Hetser "
"1","Athens","The Scarlet Letter: A soap opera","Although this book"
"4","Prunedale","This book is Great!","One might notice that many of the negative reviews of this book contain horrible grammer and multiple spelling errors. Although I respect those who disliked The Scarlet Letter"
"2","Lake Mohawk","I had to read it...","I had to read this book for school. I did not like it. I'm not sure what the point is of this story; several people hae told me what they think it is but I dont agree and they dont agree with each other."
"3","College Park","Possibly the funniest movie ever made.","It starts off a bit slow"
"3","Sioux Falls","same problems as munchkin version","Ditto to other complaints - won't separate easily- either by unscrewing or prizing. Cheap"
"5","Oak Creek","Sassy Baby Warming Dish. Interesting concept.","We tried the Baby warming dish. We found that for our 1 year old it was pretty small"
"2","Lake Butler","Unreadable!","As good as this book may be"
"2","Leland","Used for circuits project","I used the generator for a circuits project and it works pretty well with little resistance"
"2","Tracy","Two Tedious Hours","The early success of Adam Sandler's films gave him this mistaken impression that he was an actor and a writer. This film proves he is neither - and a grating voice-over guy to boot. I enjoyed Happy Gilmore and to a much lesser degree"
"1","Rainbow City","one of the worst movies of 2002","god!!! what a dumb movie. the fact that Adam Sandler can do this is just wrong....never lives up to what if true and it down right smells like cheese....sick and demented jokes dont help its premise...though Whitey gets a few lifes...nicely animated but a poor outcome. think of this as a guide beofer watching it...Jon Lovitz"
"3","Methuen Town","Fantastic","A movie that makes you feel a lot better about the holidays. Although not a childish movie"
"2","Bethel","very disappointing","The movie is vulgar and not meant for children. It is a typical Adam Sandler movie"
"2","Audubon","Sandler Strikes Out","8 Crazy Nights might have been a sweet film with a good message for kids"
"2","Diamondhead","Not the worst"," but far from good"
"3","Laurinburg","Been waiting for a foreign lauguage AOL CD?","I have"
"3","Selma","It Rises above the Fluff Books","The first thing that struck me was that it was easy to read. The print was readable and the illustrations were helpful. I did also find some grammatical errors as an earlier review said. But mostly it was very specific and practical. The chapters most helpful were on emotional states and music. It's hard to find a book on this subject that's across the board"
"5","Felida","Itten The Elements of Color","I was so very pleased to review the art book which arrived in pristine condition. I would have rated it in Excellent condition"
"4","Quincy","great IMO","First of all"
"4","Woodbridge","I wish...","...i had never heard Fair to Midland before hearing this music but cant help making comparisons. It is still wonderful music and Ill explore it further..."
"4","Perryton","Good follow-up to El Cielo.","A bit of a change this time for Dredg"
"1","Fairmount","WOW!","This book really bothers me. If you are a parent trying to deal with the daily struggles of having a child with a disability"
"5","West Warwick","80s Hard Rock","One of the 80s rock bands that capture my ears!!! It's pity that they are almost retiring soon..."
"2","Marlboro Village","Low class effort by High Class Band","This material represents why the 80's died"
"4","Justice","Good Quality Cell Phone Holder","Contrary to other review"
"3","Berlin","Loved it!","I LOVE Christmas movies and these are some of my favorites! I always bring them out when I am decorating and start enjoying the holidays!"
"4","Mount Holly","Charlie Brown Christmas was a Great Christmas Gift!","I gave this movie to a co-worker who loves all the Charlie Brown classics that are shown on TV. She was thrilled when she opened it!"
"4","East Fishkill","There is no way anyone with a soul could ever give this a negative review....","This is one of the sweetest"
"4","Cortlandt","I ought to slug those R movie loving critics! They don't know entertainment as Krusty would say","I do love Charlie Brown's Christmas"
"5","Plattekill","Charlie Brown Christmas","One of my favorite Christmas shows of all time! Great service from the provider."
"3","Bristol","Proof that good things are built to last","When Mr. Schulz and Bill Melendez decided to launch this half-hour special for TV there were many things against the odds: The music"
"4","Woodburn","great Christmas gift","This is a classic Christmas tale and was a wonderful gift. I bought it for my friend and she said she will watch it every year."
"3","Santa Clara","Yahoo for Charlie Brown","Being able to watch something like A Charlie Brown Christmas whenever I want is so soothing to the soul. Especially since I get really busy around the holidays and can't always catch it on TV."
"3","Garner","The Best Present Of All","My children are a little old (age-wise) for this"
"5","Bothell West","Classic","Watched this with my two year old daughter for the first time this Christmas. It was nice to watch a classic movie that I grew up watching as a kid myself"
"2","Neenah","Not a real Rammstein album.","Bootleg collection of b-sides"
"2","Topeka","After a few months- broken","This charger worked fine for a few months"
"4","South St. Paul","Works great"," and half the price"
"5","Arcadia","This is a good product!","When my Mac Powerbook G4's cord started going on the fritz a year and a half after I had gotten my laptop"
"5","Fayetteville","Quite Satisfactory","This product works well"
"4","Lithia Springs","Great product at a great price","A replacement adapter for my 4-year-old G4 Powerbook was going to cost $80 from Apple. The Macally adapter is less than half the price"
"4","Henderson","Excellent Item!","I miss the lighted ring telling you that the charger is charging"
"2","Walker Mill","Off and on","Its hard to find these types of chargers since Mac switched to the magnetic type. Its hit and miss with the working. My battery indicator switches from charging to not in a blinking fashion."
"2","Beaver Falls","Cheap"," Doesn't charge"
"4","Orangeburg","So much better than the apple version!","I love it"
"4","Noblesville","Good product at reasonable price","Though the output of this power supply is lower than the Apple supply"
