"score","city","title","review"
"3","Lenexa","A brilliant achievement. Symbolism beyond comparison.","This is my favorite book yet (and by the way"
"4","Speedway","great classic book","this book came on time and was in good condition. It has been on my list of books to read for a very long time"
"5","Wapakoneta","A fairly simple story with deep meaning","LOTF is a short and simple novel with a deep subject matter. Golding tries to convey his beliefs in the innate evil in individual humanity through a story wrought with simplicity.Golding does a great job in developing the characters of LOTF. The characters (unlike the 90's movie) are quite believable. Each of the main characters have their own personality and are utilized by Golding to symbolize his ideas.Golding uses a lot of imagery and symbolism"
"3","Cupertino","No wonder they call it the Lord of the Flies this book stunk","My favorite chapter in this book would definitely be the first chapter when the kids are introduced on the island. There was this one kid that everyone had called piggy. To me that is the funniest thing in the world. I don't know why but the humiliation of another kid is extremely hilarious. It may seem cruel but to me it's funny. I would have to say that this book was definitely for the older more mature kids"
"2","Goshen","a conventional view of mankind","this book exists to support the author's opinion that man is brutish and destructive.this was written well before clinical studies of violance"
"2","Streamwood","Took too long","It's great ordering a book"
"3","Wilkinsburg","May be a classic...but not as good as people think","I was required to read this book for school in my Honors English Class(9th grade)"
"1","Dallas","Lord of the Flies was creative"," but lost our attention."
"4","Antrim","A great book on so many levels","I first read this book at a young age. I enjoyed it very greatly then. Not as an allagory for anything or as anything of that sort but as a story of adventure and survival. Recently I have read it with my english class and explored the symbolism and allegories. I think that the lord of the flies is a very strong book with a strong message that can be understood at many levels and I think that this is a book that ever family that enjoys reading should own. The Lord of the Flies can be enjoyed and reread by people of all ages and spending an hour to read up on the symbolism in this book is well worth it as it enriches the story alot and provides a whole new meaning to the book. 5/5 for a great read for all ages."
"3","Innsbrook","Shocking","I loved this book. It explores social interactions between young males"
"2","Council Bluffs","Novel review of the Lord of the Flies","The Lord of the Flies by William Golding wasn't as good as I thought it was going to be. I thought that the idea of the book was very good and the theme was well thought out"
"4","Paradise Valley","Nice Book","I think it was a good book because the story was very interesting and easy to read . The message of the novel is very important important because it relates to ancient times"
"5","Elizabeth City","Adventouros story"," good plot and fantastic characters!"
"4","Central","Thought-provoking"," creepy"
"3","Hyrum","Everyone Should Read this Novel","This is one of those novels that everyone should read. Through isolation on a remotes island"
"3","Naperville","the what ol' days?","I cannot say enough about this book. There is so much depth in it and so much ot think about. There's more than just an innocence lost thing in it -like the choir leader"
"3","Somerville","A girlie book with lots of blood","Friends who know I`m interested in war history recommended this book. But this is not war history. This is a rather banal love story mixed up with a lot of bloody details. If you are looking for the real stuff"
"3","Hollywood","Disappointing: Outdated and Not Useful","This book was written in 1987! Technically speaking"
"2","Wausau","They cut the extras","I dunno about the stand-alone Blu Ray"
"1","Yonkers","Extremely poor continuation","I am a big Jane Austen's fan"
"1","Little Falls","very dull and witless","This was a dull read that I had to force myself to finish. The plot wanders aimlessly and is hard to follow. Mnay of the other continuations are better than this so I would recommend saving your money."
"3","Canyon Lake","Not for kids under 12 years old","While the finished product--a working phone with see-through cover and flashing lights--is great"
"3","New Haven","Compact Phono: Portable And Plays 78 RPMs","This battery operated little jewel allows playing of old 78's and stillsounds reasonable in it's single onboard speaker mode. It also has thestandard stereo outputs to drive an external soound system for all threeRPMs. All this and it's built to pack around.My wife called it one of the best electronics purchases I've ever made.."
"5","Colonia","A great"," varied album."
"3","Dedham","THE favorite book in our house.","We love reading this book to our six month old. It has a rhythm to it that makes it so much fun. The illustrations are adorable and the story-line is very creative. The cardboard books are best for a young baby who likes to turn the pages too.I give this book as gifts all the time."
"1","Yulee","Very concerned about The Einstein Syndrome","First of all"
"4","San Diego Country Estates","Einstein Syndrome...Bright Children Who Talk Late","If you have a child that is late with speech development"
"4","Roseville","How to go to College Almost for Free","I bought this for my grandson"
"5","Bordentown","Cool Book","I'm not much for writing book reviews"
"4","Milpitas","How To Go To College For Almost Free","This book is very informative. Ben Kaplan manages to convey the information in a fun and lighthearted manner. This is a great book for parents and students alike."
"2","Fort Pierce","The academic types love it.","I guess it makes one feel intellectually in touch if he can praise this book. I guess I will never make it to that level"
"5","Tremonton","THE great American literary genius of the 20th Century.","Let's see now ... have you bought in to the PowerPoint"
"4","Babylon","Orson Welles and Magic","I have always been a fan of Orson Welles on radio and television. Having collected a ton of radio broadcasts on CD and audio cassette and having watched most of his movies"
"4","West Haven","Used It For Years","We've used this product for many years. It cleans stainless steel coffee pots perfectly. They shine better than they did when new."
"2","Philipstown","Poor Service from Home and Beyond","I still have not receivied what I ordered and paid for. They claim the first shippemnt was damaged and have yet to ship a replacement. Three phone calls were not returned from them. The vendor is very slow to resolve the problem. They said it would be here last week"
"2","Mead Valley","Vapid and vacuous","The main character was insufferable. Parker has tried to create a male Spencer but fails miserably. She appears to be without fault and has an answer for everything. At least Spencer admits to feet of clay. The plot was implausible."
"3","Chelmsford","Dumber & Dumber","Yeah"
"4","Oildale","Parker's new charge...","Being a huge Spenser fan I am of course a Robert B. Parker fan. Sunny Randall makes her debut in this yarn of sex"
"3","Burnsville","Hard rock meets ambient","Listening to the song 'Alone' right now compels me to write this review. If nothing"
"3","East Bradford","Awesome series.","The autumn series its just amazing"
"1","North Union","GSM Phones","Alot of stuff for Nokia is GSM only. Pull off your battery"
"4","La Mesa","excellent reading","this is the best book i have ever read on jesus other than the bible. this man was very knowledgeable about his subject. he was also very familiar with his subject [jesus] as you will see when you read this book. no christian should be without this book in his library."
"4","Fox Lake","typos galore!","I do not intend to review content here. This new edition is so full of typographical errors that sometimes the reader will have to intuit what the author really wrote. It is clear that the proofreaders of this edition were not actually reading; they were simply following the little red lines under the misspelled words. This has resulted in some truly bizarre apparent statements by the author"
"3","Avon","Overrated","This book is overrated by a longshot. If I didn't know any better I could swear that this book wasn't even edited! Turtledove has 50 things going on at once! There are too many characters and too little continuity. I would recommend this book to anyone who has insomnia."
"1","Lake Mary","Very slow","Turtledove certainly has a good grasp of history but the quality of his writing is only so-so. When you combine this with a very long plot development and stereotypical characters it is almost impossible to finish one volume"
"3","Laramie","Fresh and exciting!","When I first heard the cd I was a bit shocked. These musicians really have a unique way of playing these pieces. I am quite used to period performances of romantic music but this feels really unique. The more I listen"
"3","Gardendale","Great for the beginner"," the experienced"
"5","Radnor","Great product!","I took a chance ordering this product"
"4","Liberty","A Definite Page Turner!","This was an excellent story about World War II. Three friends who share quality time at Sakkara on an archeological expedition are seperated by the War. Harry Waever is in military intelligence for the United States. His other two friends"
"5","Syracuse","Enthralling","My son and I started reading parts of this in the car on a trip. We are both aficionados of anything mythological"
"3","Davidson","Great book; the worst print quality you'll ever seen","The book delivered by Amazon.com looks like a photocopied book"
"2","Alpine","Not good","I tried to read it"
"2","Alexander City","bad video","James Earl Jones butchers the narration of this 'live' presentation (he was far worse on the actual broadcast: this has been slightly edited!) and the actors portraying Clay Shaw and David Ferrie are horrible. This show was a classic example of the overkill that came after JFK came out in late 1991---everything good"
"3","Azusa","Good packaging - no mushrooms :(","While this mushroom kit arrived in good packaging and looked ready to go"
"5","Highlands Ranch","satisfying middle book of a fantasy/romance trilogy","Valeria is now accepted by the Riding School"
"3","Groton","beware","First of all"
"2","Lakewood","Sometimes less is more!","I saw this film because I was such a fan of the orignal version. What a dissapointment. This film goes heavy on the gross-out and special effects because the story is weak and full of holes. The original was much scarier because of what you didn't see. The imagination is a powerful tool. We can imagine much worse that what we see. Just knowing the blob was somewhere"
"5","Beloit","The Blob- Fear has no shape","This 1988 version of The Blob is fantastic. I Love this movie so much"
"2","Lawton","A family saga that disappoints","I got this book because Ursula Hegi wrote an Oprah Winfrey pick Stone From the River some years ago and I remember enjoying that book.. While I love a good family saga"
"5","Pine Castle","Excellent even for those without formal musical training","Excellent book. Does not assume any musical training"
"4","South Daytona","Another rocking Weeds Season.","Yet another awesome season of Weeds. A must have it you have the other 3 seasons."
"3","Greenville","Great series","A must have series. On the lines of Sherman Oaks if anyone actually saw it). Hats off too showtime. I only wish i could find the Sherman Oaks series on Amazon."
"3","Tuba City","Kate Mulgrew before Voyager","A Time for Miracles is an underrated gem. Showing a bit of American history that is often neglected"
"4","Storm Lake","Endless Supply of Ink","The ink was inexpensive"
"2","Council Bluffs","How To Write a Movie in 21 Days","I purchased and read this book because it was recommended by an author that has helped me develop in the screenwriting craft. But I didn't find it particularly helpful or practical. However"
"3","Crowley","This book makes anyone think he/she can write a screenplay with the inner movie method...","Wonderful intro...author clearly explains that if the readers want a more difficult route they can go with Syn Field's books"
"4","Hermantown","Sarah and O'Malley","Excellent description of these two characters; Sarah is an alien"
"3","Warrensburg","Out of the ashes","The Soka Gakkai was forged out of the rubble of postwar Japan. This is the story of how a small group with a generally poor and ill membership overcomes the harshness of the environment and forged a new chapter of Buddhism. For the critic above one simple question"
"4","Edgewood","A Great Summary of Labor Law","I am an ESL teacher with a background in law. A Colombian lawyer who had previously studied with me asked me to help her with the differences between our labor laws. This book was an excellent introduction to labor law. Anyone who needs a summary of this area will benefit from this book.TCB"
"1","Grove City","Very disappointed!","Very disappointed with this item! First"
"2","Elwood","Superficial","I found the content of the book very superficial. It deals with eliminating the symptoms of lack of motivation: things like Kill your television"
"5","Grinnell","Good video"," Great Gift for new Parents"
"2","Elon","Did not fit BCM carry handle","Just as the title says. This mount did not seat properly or at all on my BCM milspec carry handle. i think these are hit or miss."
"4","West Jordan","CCS Yellow Cutting Pad","Used with a Porter Cable buffer/vibrator"
"3","Norfolk","WORTH IT!!!!","Once we finally rec'd the correct item ( orig order not from this company"
"1","Prineville","Terrible Disappointment -- parts don't fit","My son (almost 8) and my husband (an engineer) sat down to put this together. Many of the holes were either drilled too small or"
"4","Salida","Entertaining to the last page","Trollope is addictive"
"1","Atchison","Printer won't work now...","I have an HP Officejet 6210 and I figured I'd try this refill for my 94 ink cartridge. Filling it up was a pain because I had to hold the refill needly just barely into the created hole and let it drip in there slowly. My biggest problem was that after I refilled my cartridge"
"4","Centennial","good","I enjoy having a cartridge ink quick at my disposal . The cost is very economical. I will buy again."
"3","Pullman","I was not pleased","I was having trouble finding a copy of this classic movie anywhere. I was eccited to see a copy on DVD Unfortunatley the word COPY is correct. It was a copy. The quality is good and the Menu looks good but the disc was definetly a copy. The case was also a copy. I am glad to have this in my collection nonetheless but was upset it was not original."
"1","Daytona Beach","Trite"," predictable tear jerker"
"5","Brunswick","All That Matters","I thoroughly enjoyed both of Jan Goldsteins books. Both left me wanting more stories from him. Characters are alive and make you care about them almost immediately. I would recommend All That Matters to anyone and everyone."
"2","Greenville","Item Not Available","This item was out of stock"
"3","Newtown","Twilight Zone fans will love it","I really liked this one. It's been a long time since I've read any short story collection"
"3","Socorro","Deaver's short stories are a joy","Jeffrey Deaver is a master at creating the twist ending that you never see coming"
"1","Sweet Home","I want my [money] back!","I was the only one in my senior English class who loved the epic poem. Several years later I bought a copy of it at a comic book shop.For some reason"
"2","McLean","It is a Lambert movie","Bad special effects. Lambert looked bored at times. The plot has a few holes. Too much cleavage. Bad fight scenes. Beowulf can do multiple black flips and spin in the air and yet the monsters can still hit him! The fact that Grendel's mother is pregnant doesn't really play into the movie"
"4","Herriman","Inspiring and Soul-Searching!","Through a Narrow Gate is a testament to the personal struggle between feeling the faith and wanting to somehow live it"
"4","Grain Valley","Through the Narrow Gate","Older book with new foreword. Personal discription of life in convent by well-known religious author."
"2","Lakewood Park","too goofy and cheesy....","Since the book is one of the more expensive Luna line books"
"1","Conyers","Eggs stuck immediately","I bought this pan because Consumer Reports gave it such high marks. The very first time I used it"
"4","Okemos","Perfect!","We received this as a wedding gift. Three years later it looks like new! It cleans easily"
"3","Lockport","A daughter of the Mennonites","Very good. READ until 5:00 AM and could not wait to finish the book today. Would recommend it to any age group."
"1","Midland","Needlessly Repetitive to Make the Story More Interesting","This is the first Hillerman story I've read"
"4","Montgomery","(Based on a) True Story","Hey readers out there. I just looked this book up because the November 24 edition of the Los Angeles Times ran the true amazing story of this incident. I guess now I'll have to read the book. When I do I'll come back with my review. You can get the LA Times on-line."
"3","Bethany","a great disappointment","The plug into the GPS 276c will not stay connected with the gps on a table or upright on the boat; where I planned on using the etrac. Both the a/c adapter and the car charger have the same attachment plug; I returned both to Amazon when I returned from Central America."
"2","Fairmount","Cibo Matto has made an incredibly boring album","Having heard the decent track by Cibo Matto Sci-fi Wasabi on a CMJ sampler"
"3","Clinton","You've got to be kidding!","Why would they release such a complete mess like SciFi Wasabi as a single?...completely turns me away from wanting to hear the rest. Musically and lyrically a disaster. I'd rather sit through karaoke night at the local drinking dive."
"5","Lower Saucon","Better Than the First","But not as revolutionary as the first album Viva La Woman. I bought this CD being told it was like the Beastie Boys were women. That was a lie; but Cibo Matto is crazy like the Beastie Boys. Their music is sometimes Electronica"
"3","Maywood","Excellent Movies","I saw Mission Impossible I when it first came out in theaters"
"3","Leisure City","Rust problems","This is a great kettle with one serious flaw. My kettle has started rusting inside the spout after 1 year. There is a lip where the spout joins the base and water is caught there after use."
"4","Brighton","A delicious spiritual journey.","For all those who have been"
"2","Snohomish","Raises good questions"," but was it edited?"
"5","Herriman","ellery queen mysteriesa","This was a very different type of book from what i'm usesd to. It was very goog.I am a big fan of ellery queen."
"5","Susanville","A very nice shoe","I bought this more for fashion than function"
"4","Cheyenne","Great running shoe but why is price way up?","The double-edged sword of rating a product highly: you help out fellow shoppers but then the vendor raises the price. I bought this exact shoe 1-1/2 yrs ago for $45 w/free Super-Saver shipping. Now the shoe costs $73 + shipping? Maybe we should all keep our mouths shut. And what's w/the different pricing for different sizing? Sounds like discrimination to me. Could be a federal offense.I've given it 5 stars to see how much higher the price rises."
"5","Mooresville","A classic","It was just as good as I remembered! The grand kids (2&4) sat mesmerized for the entire movie! Ttkhanks for the nice afternoon!"
"4","Catalina Foothills","So sweet!","Kept my 2 year old interested which is hard to do!!! The ending is. Little weird bc it feels lime something is missing but cute movie overall!"
"2","Pawtucket","Forced previews","The movie is fine"
"3","Weston","A perfect film","Babe comes the closest to being a perfect film out of anything I've seen. Everything in the film should be there"
"3","Little Egg Harbor","Not Good At All","This is the WORST movie I have EVER seen. We had to see it in our class one day. The teacher said that I HAD to watch. Reluctantly"
"4","Trumbull","No Skip-Ahead function on this DVD","BABE is a wonderful movie"
"3","La Cañada Flintridge","Dundee II","Very good sequel. Moderate amount of action & an actual plot unlike many new movies. If you own the first this is a definite addition to your video home library"
"3","Mount Pleasant","Non-stick Coating Wore Off and is Chipping After Three Months","I bought this pan with high expectations given the strong reviews from other customers but after a few months of use I am very disappointed. The pan takes several coats of oil to prevent food from sticking and now the non-stick surface is beginning to flake off. I always washed the pan by hand and never used anything other than plastic cooking utensils. The last non-stick pan I had was Kirkland brand and it lasted four years."
"4","New Braunfels","Oldie and Goodie","My father got me hooked on these books. They are extremely well written and just fun to read. Anyone who just wants a good mystery without all the sex and swearing will love these books."
"5","Santa Barbara","Excellent stuff!","This face wash is great"
"2","Derry","Worse than surgery","The jokes in this book are not only unfunny"
"5","Prairie Ridge","Amazing but not his best","This is Jimi's most famous performance"
"1","Graham","poor","The product did not operate as stated on the box. The supplier CDROMUSA wasn't at all helpful and left me with a product I'm unable to use; so they got FREE money and refused to send a replacement.They don't deserve a star at all"
"4","Roselle","movies that make you THINK","How many times in our lives have we wanted a do over in our lives thinking if we could just change one of our actions things would have been so much better in our present day lives. These movies make you realize"
"2","Camillus","Overpriced and too many restrictions on use","This item is very overpriced. I ordered it because I wanted the very best"
"3","Sheffield Lake","My recommended buy","Had bought a set of the Anolon Advanced Hard Anodized Nonstick cookware"
"2","Salida","Not good at all!","This book actually pokes on Henry's contemporaries and describes series of events which will eventaully lead to a horrendous headache to be suffered by the reader. On the other hand"
"1","Webster","A Disappointment","I've long been a fan of Robert B. Parker Spenser books but"
"5","Ferndale","The Power of the Witch","I loved this book. It's very informitive. I like the fact that my friend"
"3","Mansfield","Not Impressed by Cabot","I expected great things from Cabot's books. I was let down. I did not care for her writing style"
"1","Steubenville","A guide to one-night stands","This book is confusing and difficult to follow because the author tries to cover one-night-stands and polygynous dating with the same advice. Basically"
"3","Libertyville","Not entirely original...","Actually everything in the book IS helpful"
"2","Endicott","Some reasonable advice.","I like the book but its a bit over the top in places.There is some good advice and if used sensibly is okay.Its a good book.I recommend these"
"3","Stoughton","Read The Art of Seduction instead","This is amateur stuff. If you want to get really useful and ground-breaking stuff"
"2","Country Club Estates","For anyone else"," 4 stars. For Laura"
"2","Coweta","One of the worst spokeseman for my party..","Let this illogical hack please not defend my party"
"3","Bucyrus","better than the swiffer","I love the simplee clean microfiber swivel mop. It is bigger and easier to use than the swiffer and you don't have to keep buying replacement sheets...just wash and go. A much more environmental and financial choice than other cleaning options."
"4","Springdale","My floors are always cleaned with a CLEAN mop now!","I do think this item works great as a mop and as a dust mop"
"1","Swansea","Depends on your situation","I bought this along with the authors' grammar reference"
"3","Randallstown","Does a good job","Mach3 does a fine shaving job"
"4","Levittown","Works just fine"," but not cheap at all"
"2","Englewood","Horrible Shaving System","I purchased the razor and blades as the double-bladed sensor was out of stock. This is the worst design Gillette has yet put forth. The 3-blade design is much too wide and clumsy. The only shaving done with this razor system was my first layer of skin."
"3","South Hill","Mach3 or crap3","Very poor quality"
"2","New Castle","Somehow not as good as Birks","They run MUCH smaller than Birkenstocks. I sent the size 44 back (which is comfy in the comparable model in Birkenstocks; is it the Boston?) and got the 45 and it STILL feels small. The upper is ok"
"3","Carneys Point","Very Nice!","My wife and I go on vacation only once a year but this is perfect for the beach. It's also nice to walk on the board walk or in surf shops."
"4","Newmarket","good piece of collection","This video reflects the early years of Pink Floyd. In that time a bunch of innovative guys"
"1","Lombard","Garbage!!!","I'll keep it short and sweet. This product is garbage. I purchased a vinyl cover to further protect the item"
"3","Salem","Superb Short Stories!","This book is a delightful surprise"
