"score","city","title","review"
"3","North Charleston","Loved it!","Reading through the table of contents of the book I had this sense of familiarity. The first few chapters have been titled and themed in such a way that it bring to mind the creation story found in the Bible. Granted"
"4","Glendale Heights","K&N air filter","This product really allows my suzuki gsxr to breathe better - Its a great item and i will be sure to recommend you to other bike riding friends of mine."
"4","Rendon","good breather","its a different shape than the stock filter for my 82' xv750 but the holes line up fine and it fits well in my airbox"
"3","Martin","A great filter that gave me extra power","I bought this for my Suzuki Boulevard C50 because I wanted a washable filter that lasted a long time. I heard people talking about how a K&N filter gave them extra power. I didn't really believe all that"
"5","South Huntington","Good Purchase Experience","The filter was exactly as identifed when ordered. It was shipped promptly and packaged well enough to protect it during shipment."
"5","Alcoa","Great price","2010 Honda Goldwing very good price for a performance filter that can be washed and reused. Plus I believe that K&N filters flow more air."
"5","Lower Moreland","Not great but is okay","All right"
"1","Waunakee","Didn't fit properly.","I purchased the K&N HA-6003 as a replacement for the stock filter in my 2003 Honda CBR600RR. The fit of the K&N was poor at best. I did manage to get it in"
"3","Bronx","K&N's for every ride I own...","I always purchase K&N air filters for every vehicle I own"
"1","Ripon","Wouldn't work","The sharpener sat around for a month or so before I used it. When I went to use it"
"3","Taunton","not heavy duty!","This sharpener is a joke. I have a small school and need to sharpen 10-20 pencils a day. Bought this heavy duty model"
"1","Randallstown","Don't Buy This!","Expensive as it is"
"3","Cleveland Heights","mediocre","In my opinion"
"2","Oldsmar","This is NOT the SHELL SEEKERS","This film bears only a passing resemblance to Rosamund Pilcher's THE SHELL SEEKERS. The director watered down the book's powerful plot to weak tea and you will barely recognize the characters. Angela Lansbury does her best but cannot help the tepid writing. The casting was almost completely off the mark - Danus is particularly badly cast. I expected a better film from the Hallmark Hall of Fame. This was so bad it took me 3 trys to get through to the end. Don't buy it. In fact"
"2","Nanuet","quiet. then loud.","This recording takes the dynamics to the point where some passages are barely audible and you have to strain to hear them and then as you're straining and your ears are completely open and unprotected you get hit with the frying pan. It's like being abused with music. An anxiety inducing recording. Tried listening to it numerous times"
"2","Hamilton","delta sigma book","Hi"
"3","Dublin","Fun to dance to","This collection of music is so cool. It gives you a quick glimpse of alot of different artists. It has nice catchy tunes all through the cd."
"1","Mount Pleasant","One of the Top Ten Worst Movies of All Time","I am still in shell-shock that people of quality such as Chloe Sevigny & Stephen Rea could even finish filming this piece of dog doo-doo"
"1","Dingman","Poorly Done!","Fist of that version of the national anthem was the pitts!I mean all of those train and carrying on was ridiculous! First off no one will and ever sing the National Anthem like Whitney Houston! Beyonce did an alright job! People are making that up to be something its not!Thank You for your time and consideration!!Sincerly Yours"
"4","Kent","Short stories for philosophers"," literature snobs"
"1","Rock Springs","Can you say cardboard with cheese flavor","Like the other Doctor Kracker Snack I reviewed they are as hard as a rock. Reminds me of pasteboard with cheese flavoring."
"5","Ensley","Personal and universal","If you love Paul Williams and if you love Dylan this is an unbeatable experience"
"2","Clayton","Drew Barrymore has made her opps! movie once again","Drew Barrymore has been having a hard time making good movies after making the the movie Ever After which i thought was a OKAY movie"
"3","Shreveport","BORING!! But barley okey","This is the dulliest unsatisfiting of all time . Even though Drew Barrymore is in it . It still doesn't steal the show . The middle was okey but the rest was just plain Garbage ."
"3","Wauconda","Home Fired!","It is a very good thing that Drew Barrymore did not choose this film to kick start her career. This film was a bomb from the word go. It was overly campy and completely unbelieveable. While the premise of the story is somewhat interesting"
"4","Clarksburg","Best TV Series EVER EVER EVER EVER EVER","As the cover said"
"5","Bernalillo","Great Art based on Great Art","This production need not be limited to ever made for TV. This is one of the greatest and most profound movies ever made. Every element of every scene is superb and riveting. I watched it again"
"3","Bayonne","it doesn't ever get better than this...","they show this on PBS sometimes so even if you choose not to purchase the best drama ever to grace the 21 inch screen you can still see it. it is so far above anything else to first appear on television you may wonder how it ever was produced! perhaps that is a story in of itself. in any case it is truly one of a kind and to not see it would be like never seeing Dr. Zhivago or Casablanca or any of the other larger than life tragic love stories of this century."
"2","Daly City","Brides head revisited","This product was ompossible to watch the sequence of episodes was all mixed upFor example episode 9 was only able to be played by pressing episode11 and so on.When there were three episodes on a disc the middle episode would not respondAnd could not be played.I was amazed to receive such an inferior product from amazon."
"3","Healdsburg","Blu-Ray version washed out and colorless","This is one of my favorite tv shows of all time"
"3","Queens","As wonderful as I remembered it!","Can't go wrong with the content. Amazing acting"
"1","Brentwood","Bird is always bird","Its ok for a single DVD. However"
"2","Hillcrest","Beware of Seller","I ordered this book mid-April for Mother's Day. It did not arrive at the estimated time. I waited another week then contacted the dealer. They said I needed to wait the maximum shipping time before they could resolve the issue. It still did not arrive so I contacted them again and they stated that they would send the book now. I waited again and it still didn't arrive so I sent another email. Amazon has issued a refund because the seller now says that the book is apparently out of stock. I feel they should have said that from the beginning."
"4","Woonsocket","A good starter book to help focus on WWII books of interest","I really liked this book. I use it to further add books to my Wishlist. Dunnigan's mini-summaries of included books are loaded with details. I have several books by Dunnigan all of which I have enjoyed reading. Some other reviewers have provided less than glowing reviews of some of his books. I try to keep things in perspective so flaws noted are not ignored. Given his background and experiences"
"3","Athens","Schiller","This is the second edition of this book. The Translator spent years on researching and putting Schiller's works together. He worked closely with the Germans to make sure that he got this right. However"
"2","Towson","What a disappointment...","I agree wholeheartedly with the first reviewer- what is the point of this boxed set? I have YesYears as well"
"5","Midwest City","YesYore","Judicious choice of tracks by Steve Howe makes a seemingly inessential purchase (how many best-of's/repackagings from the band in recent years?) hard to pass up. Disdaining the live tracks"
"2","Coos Bay","NOT ORIGINAL ARTISTS","This is NOT a compilation of Original Releases. It is a DEMO of publishing co. Soundtracks."
"4","Westlake","Barbara Crampton looks great in leather!","Great horror movie! Jeffrey Combs does very well in this one"
"1","Dover","I'm unhappy !!!!","I didn't receive this item. I live in Brazil and I asked to a friend of mine"
"4","Wahiawa","Fantastic but","The design of this basketball system is fantastic. It is so easy to move and so easy to raise or lower the backboard. It is sturdier than most movable systems and with the 4 wheels and the leaver action you can easily move it from one place to the other without emptying the reservoir. If it is a windy day you can easily lower the back board. Now that I have raved about the product let me give you the negative"
"4","Longmont","Pure magic","Morgan LLywelyn is one the most gifted writers writing today and Lion of Ireland is her masterpiece. You feel her passion and the love she has for the Irish in her words and her unique storytelling talent makes this book one of the best books I have ever read."
"5","Wawarsing","A truly magical book","This book is a master piece. This was the best book I ever read and I should know I'm only 13 but I've read more than my share of books. This should be turned into a movie"
"2","Abington","Trite and predictable","I was excited to read this book based on the reviews"
"3","Menomonie","A big disappointment","I disagree with the reviewer who characterized the author as a poor writer. She isn't. The problem is the content. After reading the first 90 pages"
"2","Montclair","Catastrophic Hissy Fit","How do you take an idea with so much promise and turn it into an excruciating read? You allow someone like Julie Powell to write about it"
"1","Grants Pass","POLITICAL ONLY","WHY DID SHE FEEL THE NEED TO KNOCK REPUBLICANS AT EVERY TURN? A REAL SIGN OF LOW INTELLIGENCE. SPOILED BOOK COMPLETELY. SHE IS VERY OPINIONATED IN ALL HER THOUGHTS AND FILTHY TALK TO BOOT...THINKS SHE IS SOPHISTICATED...BAH.BAD BOOK."
"3","Solebury","Terrible","I found this book to be simply unreadable. Too much trite dialogue and a very unlikable"
"1","Dalton","A Rambling Mess","I picked this book up with an expectation of a fun memoir read. The premise was unique...cooking all 524 recipes from Julia Child's Art of French Cooking. I expected a fun romp of cooking mishaps"
"1","St. Anthony","Movie better than the book","I have to say for the first time in my life the movie is way better than the book"
"2","North Potomac","Stay as a Blogger","This is a terrible book. Julie Powell is"
"2","Russellville","Profanity detracts from material","I can count on one hand the books I have thrown away in my lifetime of 47 years. I treasure books and respect them"
"2","Harker Heights","too much julie not enough julia","The politics gets really old really fast as do the day to day lives of the self absorbed and rather dull cast of characters. I really wanted to like the book"
"2","Hercules","Don't Buy This Just Because You Liked the Blog","I read the Julie/Julia Project blog occasionally and enjoyed it. I thought that the book would be similar"
"2","Redding","I did not like this book","After reading some of the reviews I see that there seem to be two sets of camps regarding this book: folks either loved it or hated it. I guess I'll have hang out with the haters. Julie Powell comes off as an extremely unpleasant"
"2","Dallas","Don't waste your time or money on this awful book!","Very poorly written book. It's all over the place. The f word seemed to be thrown in simply to fill space. At times I didn't have the slightest clue what she was talking about. She tried to be funny - and failed miserably. And besides being boring and poorly written she frequently takes cheap shots at republicans"
"2","Burton","I tried","I wanted to like this book. I've curled up with it a couple times now"
"2","Chester","Narcissistic Hipsters Should Cook"," Not Write"
"3","Euless","disappointing","I love both cooking and reading blogs"
"3","Binghamton","Just OK","The character was self-absorbed past distraction. In fact"
"2","South Lyon","Horrible Recipes Made Bearable","As I'm more than halfway through this book I might as well finish. Julie's less than amusing encounters with lobster slaughter"
"3","Altus","Don't waste your money","Please don't waste your time or money purchasing this book. Our book club decided to read it based on it's good reviews. Only one person out of six finished it (just to get it done). The language is foul and the story is boring and drags on"
"3","Cold Springs","Ick"," Ick"
"1","Upper Moreland","I bought this for a laugh...","This is just hilarious. Mary-Kate and Ashley releasing their Greatest Hits 3 album- what could be funnier?! I don't really know whether to give this one star for musical ability"
"5","West Deer","Must Have for Newborns","This was by far our most useful baby gift-- it helped our baby get to sleep and even saved our sanity a few times. Nothing calms a crying newborn better than a good swaddler. At first it's a little tricky to figure out how the velcro fits together"
"3","Lakeland North","Simply put - does not work","I read Dr. Karp's book and decided to buy a swaddling blanket. After doing a lot of research and reading a ton of good reviews on this one"
"1","Weare","Not for Baby Houdinis!","I was reluctant to invest in a blanket specifically for swaddling"
"3","Villa Park","worse than a straight jacket","My baby hates this even though he loves being swaddled. Definitely the worst baby product I've purchased."
"5","Shorewood","helps baby sleep better!","very nice. easy to use. highly recommended. baby always seemed to manage to escape his blankets- this he can not get out of :)"
"2","Graham","Too big","Blanket was too big in the large size for 21 inch baby at 9 lbs. They have 2 sizes but no chart to figure out which size you need. The velcro tabs are small and she could easily slip out. I'm waiting until the baby is bigger to use it"
"3","Lynden","Ok"," but there are better swaddlers"
"2","Laurel","Keep it tight!","Make sure its as tight as possible"
"4","Germantown","nice gift","This is a very uplifting mix of Christmas music. If you like Celtic music"
"3","Amity","SMALLER than what it says on the prod description.","The product came promptly and I like it. It was way cheaper than any of the big hardware chains and even one huge lumber and hardware store that caters to contractors. Item has good weight on it so it does not feel or look cheap. One thing I DID NOT like was that it was SMALLER than what the product description states. This is 1 inch in diameter NOT 1 1/4 inches. Other than that I am happy with it."
"5","Great Bend","oil rubbed door knobs","perfect size and color to replace the chrome ones when we did the redecorating in our bathroom -- lots of browns"
"5","Oxon Hill","look nice","they do look like the could cost you alot more but the quality really shows after time... the finish does remove from the knob over time but for me it wasnt a big deal since it was for a basement... but if you need if for a upscale kitchen i would pass but for a back room or an old drawer its perfect"
"1","Golden Gate","Never arrived","I ordered this so I could watch it for a paper. Too bad it never arrived and I had to scramble at last minute to find a copy."
"3","Steubenville","Made in China; that says it all!","Dont' bother with these rotors! They warped after barely 300 miles. I was assured by PowerStop that their products were NOT from China"
"1","Willingboro","N.G. For TIVO","I agree with other users.... If you read the TIVO recommended wireless network adapters"
"2","Monmouth","i dont know if it works...","worked but a weird deal"
"1","Norco","Doesn't work and very frustrating","It worked at first but the connection kept dropping. Then every time you try to open the wizard it flashes on the screen for a second and disappears. You can't get the wizard to stay on screen for more than a second so can't change any settings. A total waste of time and money - don't bother with it."
"2","Richmond","Doesn't work and merchant won't allow returns","This product is horrible. We own a Belkin and it works"
"2","Freeport","Wow! What a piece of junk!","I just spent hours of frustration trying to get this thing to work reliably. Never got it working correctly. Netgear won't just let you install the drivers and be done with it. No"
"2","San Anselmo","Don't waste your money!","Although I am very happy with the other NetGear products I own I have to say that this adapter is a waste of money. It's easy to set up (I'm running Windows 2000) and starts working at first"
"3","Bayonet Point","Delicious","Our Shiba Inu"
"4","Sandy","We all love this!","This is an excellent treat for my cats"
"2","Menlo Park","No Mre sequals!","This movie did not fill it's axpectations"
"1","Morton Grove","Big Fat Letdown","After the amazing Spider-man"
"1","Santa Monica","I wanted to like it I really did!","I thought it was slow and predictable. Tobey was good as Spiderman but his character seemed a bit whiny and was too much of an idiot. I don't get it why everyone likes Spiderman so much it's not that good of a movie. I didn't like the first one much either both Spiderman movies suck and I hope the 3rd one will be better but it will probably be the same as the first two. It's in my opinion if I didn't like it don't get mad why I didn't like it I just didn't like it."
"4","Homewood","Spiderman 2: Grade A+","This film is quite possibly the best film sequel ever made. It outshines the 2001 original. The action"
"4","Live Oak","Great movie!","I thought it was a great movie. Personally i think it's the best out of the three out today."
"2","Ewing","Marketing really does work.","I can understand just wanting to watch a trashy action film but this movie was just annoying. Tobey Maguire did his best to convince us that he really is a wet noodle. His snivelling self-conflicted"
"2","Panama City","smallville anyone?","I must admit the sequel is bucketloads better than the first. That said"
"3","Newport News","Spider 2 Strikes Gold!","This movie has an excellent story (better than the first). First rate acting"
"2","Francisville","Don't listen to the other reviewers it sucked!","I did not like Spiderman 2 at all (...)! It was like watching a soap opera movie or something with no action in it. All there is"
"4","Washington","Very awesome<3","its full of action"
"1","Niskayuna","Awful - Nearly Painful","I liked the first movie. It was generally Hollywood fluff"
"1","Horizon West","Not that Good","The first Spiderman was way better than this garbage. the acting was horrible and the action scenes... well there were hardly any action scenes. This movie sucked there was way too much talking. Doc Oc was horrible he wasn't even mean. don't waste your money."
"4","Snellville","good"," but the first was better"
"4","Orange Cove","Better than the first","Remarkably entertaining movie. I still get chills watching the action sequences on my 27 Television."
"4","Danville","Great price!","My daughter loves all the Spiderman movies and I bought her one through three for Christmas... can't beat the price!"
"3","Sandy","best hdmi player","best picture quality excellent sound and very good aesthetics .price is very low .easy to convert to all region"
"3","South Miami Heights","Build Better Than Expected","Great product at great price (69.99 with free delivery). I recently purchased a panasonice upconverting dvd player and although the video"
"1","Highlands","Would be great if I could watch it","Never mentioned in the description that this was a PAL video from another region than the USA. An omission that means a lot. I was at this show"
"5","Westborough","Wilbur Smith at his best","I bought my first Wilbur Smith book Nov'86. It was translated to Swedish. At that time (being 22 years old) I hadn't yet started to read in english on a regular basis. Out of curiosity I counted the books from this author that I had bought over the years"
"3","Cedar Park","Excellent reading"," but not perfect"
"3","Sweetwater","A trashy"," macho bodice-ripper for guys."
"4","Neshannock","Fundamentals of Management","Fundamentals of Management is a great book to get started in management. It covers everything that you would need to know. I like this book in particular because it has chapter tests at the end of every chapter so that you can kind of test yourself over what you had just did. I also liked how the definitions are out to the side of the reading as well as in bold in the reading. It makes it easy to find the words that you are looking for. I have learned a lot from this book. I went with some experience in managing and still learned something new every time I turned the page. I feel this is a great book to get started with in management."
"4","Durango","Well organized and easy to understand","My husband is using this book for his management class"
"3","Seal Beach","So cute monogrammed!","The bedding I picked out did not have a diaper stacker...so this one went perfect. To tie it in with the bedding I got the top monogrammed. It looks so cute! Very pleased with it!"
"3","East Haven","Follett's Guide to Usage","As one who thinks it necessary to own every major English usage manual from Fowler on"
"4","Rye","If you like the classics"," then why not?"
"2","Jacksonville","No Classics... RIP OFF","I bought this expecting to get the classic xmas movies such as frosty the snowman and rudoff the rednose raindeer. I was VERY disappointed to find out neither were included. It has such movies as Frosty gets Married and Rudoffs 4th of July"
"2","Magalia","get your money back","Big disappointment"
"4","Fords","Christmas Classics","This is a cute classic movie set and each disc has the main feature but then a another movie or two on it as well. I knew what I needed to order (I borrowed the box set but I broke one disc so I had to replace the whole thing). This was the cheapest place I found it. The set arrived very quickly. Thanks!"
"3","Seguin","Clasic Christmas Favorites","The grandkids loved this one. Not only did they get the favorites but the set included several the family had not seen!"
"1","Lakeland","no little drummer boy 2","the trailer on this dvd set has advertisement for little drummer boy 2 but this dvd set does not have it instead you get pinnohios christmas dont know why warner did this but thats what is there"
"5","Windsor","....And I'm Not a Stephen King FAN!!!!","While I don't relish in Horror pictures"
"3","Olney","Should become a comedy classic","This is Cyrano de Bergerac updated and told with the craziness of Steve Martin's brain--a wonderful"
"4","Waterford","Charlie","He had very long nose"
"3","Mission Bend","One good song","I like one song on this cd. It's in the Rain is a beautiful song. The rest sound like they were rushed to be completed in order to meet the release date.I have all of her other cds and I usually enjoy them"
"1","Simpsonville","Predictable an uninspired.","Enya needs a change"
"2","Eatontown","A long wait for Enh! (yuk)","Now"
"4","Fredericksburg","You lose all cred ripping someone a new 'A' when you can't spell and make grammatical errors","I'm a little tired of hearing 'this is just the same as -blah blah- song/album and it's horrible/boring'. I love Ebadue and Africa i and ii"
"3","East Renton Highlands","A Soothing Voice In a Chaotic World","If there is one musical constant in a world of chaos it is the soothing voice and melodic songs of Enya. I love her and her music. Her voice"
"4","Davie","Amarantine: More of the Good Same.","If you like Enya and you have them all"
"5","Temperance","Whyte Weaves Wonders","A friend's Florida condo is as unlikely a setting to begin Whyte's Camulod Chronicles as one can imagine"
"3","Rainbow City","Worth Every Penny!","What can I say"
"2","Searcy","This doesnt do rage credit","The Cd is a disgrace"
"3","Coal","Looking Backward","I have a bad habit of diving into major events years after they occurred. I didn't understand Enron worth spit when it happened"
"2","Elfers","boring"," boring"
"5","Sandy","Very Informative and Helpful","For anyone who searches to resolve the mysterious of stuttering"
"2","East Chicago","Larry Garfield is compared to?","When Danny Devito's plays Larry Garfield he is like Taxi's Louie De Palma of Wall Street."
"4","Albany","Great speech by Larry at the end!","Not a bad movie -- not great"
"5","West Goshen","Love having a female hero","My two and a half year old does not watch much TV but she loves Jane and the Dragon on Saturdays (she also likes Jacob Two Two and we have ordered those books as well). She was very excited when she saw the books as well. In a time when TV execs could not allow Dora to be on top (by giving Diego his own show) it is nice to have a female lead that is strong and brave but also sometimes makes mistakes and learns from them.The stories are interesting enough for older kids too."
"4","Richmond","Saw the TV show? Read the book.","If you have seen the wonderful Jane and the Dragon tv series you will enjoy the book. You hear the basic story in the theme song and wonder how Jane and her dragon met and what made the king let her train to be a knight. This book tells that story! It is an enjoyable story that engages everyone from children to adults. I highly recommend this book."
"4","State College","Great transmitter but not universal","I ordered this expecting it to come with a 3.5mm connection but came with a different connection. Although it says designed for zune the pictures are misleading so if your looking for a universal transmitter make sure it is in fact universal. This transmitter is great rarely get static and its stereo so thats a plus!"
"2","Guilford","cant rate"," don't work"
