"score","city","title","review"
"2","Wantagh","Judge a Book by Results","I purchased this book over a year and a half ago"
"4","Los Alamos","The GUIDE for serious players.","Difficult to win anything on your own. $$$ outlay by individual players is too large. Better start a pool at the office with co-workers and collect funds in order to play any of her wheeling systems. You'll share winnings and losses (small and both sides unless you hit the Jackpot). No other book comes close. Get your rabbit's foot"
"1","Pataskala","Resie This!","Give it up everyone"
"2","Klamath Falls","What the fascination?","Thurber revealed The secret Life of Walter Mitty. DuBar should have kept his life a secret unrevealed!A lot about the drinking and useless meanderings of Jules DuBar"
"1","The Hills","Not for chevy s10 pickup","One bushing fits the other doesnt"
"2","Gilroy","Incorrect parts in package","I was pleased that I got my parts so quickly but after removing my door to replace the bushings and pins I discovered that one of the two identical packages contained a incorrect bushing. This incorrect part caused the job to take about twice as long since I had to stop and make a bushing. Maybe next time I'll just make the bushings and not bother with the parts made in China."
"4","Marinette","One of the Best Buffy Eps","Buffy the Vampire Slayer is the best television show on television and if you missed the first season you can catch up on what happened now with these awsome videos. It is good formatted and is a must for a buffy fanatic like myself...all of the books are good too!"
"4","Woodbury","Phenomenal Video!","This is an absolutely phenomenal video account of Alaska! The videography"
"3","Yorkshire","A Huge Dissapointment"," Not a Complete Guide"
"2","Placerville","Publisher?","I found the book itself to be interesting and entertaining"
"5","Miami","A good reference for basic techniques","I was looking for some more advanced features than were offered"
"1","Sandy Springs","Mixed Up","This book would have been better if the couples were switched though to tell you the truth I don't understand why Bridig was even in the book"
"5","Emporia","A True Romance - One of Garwood's Best","I absolutely loved this book and could not put it down. The heroine - Gillian - was full of courage and didn't back down when faced with problems. Laird Buchanen - the hero - is all man - but you can feel how much he cares for Gillian. At the same time - there are 3 or 4 other storylines taking place that culminate in the resolution of Gillian's main problem - will she get to see her sister? does she find the treasure? how will she get Alec to his home after he is kidnapped? who is the traitor to the Sinclairs? and more! I read this book in 2 sittings - and it left me feeling happy!"
"2","Edgemere","Killing your dog","In the chapter on Pets"
"4","Groveland","Wonderful","This isn't just a history book laced with photos; this is also a personal view on the Cultural Revolution from the photographer's point of view. Informative and emotional at the same time. Wonderful."
"4","Potsdam","Wanting to be a bombshell!","I bought this DVD almost a year ago. I finally decided to use it and I am happy that I did. I did find the DVD very helpful"
"1","Calhoun","For beginners...","I have been a exercise dvd junkie for years"
"1","Kennesaw","Horrible!","I can't believe how awful this movie was and I love zombie movies. It was like watching a SyFy movie of the week. Waste of $$$$. Sucked."
"4","Chambersburg","Good series"," bad doll"
"3","Greenacres","Great for AP","Biotutor is an invaluable tool for any student taking AP Biology or struggling in a Biology class. Last year I took regular Biology and did very well. I think my average was an A or A-. But"
"2","Haddonfield","Old Program"," Poor Tutoring"
"2","Bath","waste of paper and money!","As a list of what carts were made"
"1","Henderson","pointless documentary","I mistakenly purchased this due to the similarity with the cover and STALINGRAD - DO YOU WANT TO LIVE FOREVER. This turned out to be just a pointless documentary on STALINGRAD like so many that had gone before. My bad..."
"3","Aurora","Sterling Silver Hoop Charm Peace Sign Earrings","Earrings came quickly and as described. Hard to find these little peace sign earrings in a style that is not obnoxious. Perfect gift for 70's sister."
"2","Raleigh","Disappointed","After reading reviews about every small wine cellar offered through Amazon"
"4","North Fort Myers","A woman's transformation/ a professor's redemption","Educating Rita can be enjoyed at many levels of understanding. It can simply bring pleasure and good feelings. And it can be understood as a story of love that is harnessed for the growth of each person involved in the mentoring relationship. For a woman who has to take her own journey"
"2","Haines City","soundtrack","can any body please tell me who made the music for the soundtrack?i want to know please tell me.thanx"
"4","Sherwood","Most Useful","This has become one of my most valued counseling companions. For those of you who are familiar with Glasser's Choice Theory"
"4","Alpharetta","A full range of emotions....","If you enjoy books that take you through the full range of emotions"
"2","Rainbow City","Horrible book...","I had to read Jim the Boy for my freshman english course summer reading and thought that it was a horrible choice. It had no substance and was too easy to read. Although some apparently disagree"
"5","Glen Carbon","Poignant and beautiful","This publication is absolutely beautiful. The stories"
"4","Oxford","How to tickle your funny bone.","If you want to spend a fun evening with someone"
"3","Copiague","Kai Hansen strikes again","No wonder it sounds alot like Helooween. Kai Hansen"
"3","Clarksville","What! What! No Limits on the rise again!","Easily one of the dopest cds of the year 2000"
"1","Bogota","EXPECTS TO MUCH FROM THE READER.. NOT GOOD FOR BEGINERS","THE BOOK COVERS A LOT OF STUFF AT ONCE IT SHOULD BE CALLED LEARNING TO PROGRAM THE HARD WAY DONT RECOMMEND FOR BEGINNERS MEABY JUST MEABY FOR ADVANCED PROFESSORS ..SORRY MY OPNION..DONT RECOMMEND IT TO LEARN FROM IT AS FIST VB BOOK AND BY THE WAY THE AUTHOR HAS A LOT OF GREAT BOOKS THE FIRST ONE I THINK WAS BETTER"
"5","Spout Springs","Rockin' Scandinavians","I heard this group on the radio and had to have their cd"
"1","North Little Rock","Horrible ending","I was totally enthralled by this entire series"
"4","Pico Rivera","An Excellent Edition of Sesame and Lilies","This is an excellent edition of John Ruskin's Sesame and Lilies"
"3","Woods Cross","Outstanding","Marriott was the man"
"4","Kenmore","If you are a entrepreneur"," you must read this book"
"4","Stonecrest","Anecdotes help illustrate the practical and important ideas","4 Secrets Of High Performing Organizations: Beyond The Flavor Of The Month To Lasting Results is a user friendly business manager's guide that emphasizes the importance of not falling into business or marketing fads. Instead"
"2","Bradley Gardens","ATTENTION HISTORY LOVERS","For all of you that like English History with a twist of mystery than you will love the novella"
"5","Northbrook","This highly surprising telling....","...of one of the oldest mysteries in England was thoroughly enjoyable. The story is told in an intelligent manner and seems to logically solve the mystery. Until I read another theory on these two little princes I find more believable I'll stick with this one!"
"3","Richland","Well-written"," thought-provoking"
"5","Germantown","Give Tey a try.","Did Richard III have the princes in the Tower done in? That is one of the great mysteries of history"
"4","Goldsboro","Mystery for history buffs (or a history for mystery buffs)","Josephine Tey takes us through a wonderful unraveling of centuries old history. Was Richard III the evil murderer of the princes -- or not?I think this book one of the most fascinating mixes of history and mystery (two of my favorite areas) and reread it regularly. So when my book club asked me to recommend a mystery"
"4","Martinsburg","A big short read","Wonderfully written and hugely educational"
"1","Pleasant Valley","poor quality","These pajamas last only two months before the silk started to tear at the waist and in the crotch area. For this price I would expect that they would have been much better quality and last longer than two months."
"1","Milton","Ripped off.","I recently bought these silk pajamas for my husband's birthday. Within a week"
"3","Ogden","Very disappointed","This arrived in a different package and bottle than shown. The box has tear marks and is beat up. It also has a nasty"
"3","Coram","Paper feed nightmare","I just wanted to add my voice to those who already mentioned the problems with paper feed. Not long after I bought this model (but too late to return)it started having problems with the paper feed. I now have to hand feed each piece of paper"
"2","Prairie Ridge","yes total waste of money","This is the second HP printer I bought and frankly the only reason I tried this printer was because of the network connectivity. I haven't written many reviews before"
"1","Boulder Hill","DO NOT PURCHASE","I have actually not yet had the paper feed issue like the rest of the reviewers"
"2","Beaumont","Paper jams"," bloated driver"
"2","Santa Monica","Yes"," the paper does not feed correctly!"
"1","Bethpage","Who Framed Roger Rabbit","I bought this movie new"
"1","Audubon","no","Why did you send a dvd that you are very sure it does not work here in The United States? Does it make any sense for you? Why don't ask us to be sure before send it to another Country? If you know that it won't work on that Country?"
"2","Wilmington","Idk","It doesn't play in normal DVD players. So idk where I could watch it. I was looking forward to watching it."
"5","Williston","Took My Breath Away","Ok"
"4","Edison","Five stars aint nothin'. I'd Give it 10000 If I could","My Grandmother bought this for me when I was 2 years old. I've loved since then. I havent watched it in a while so I decided to watch it one day when nothing was interesting on T.V. This movie bought back so many memories of when me"
"5","West Park","Hooked on the Brothers!","Super Mario Bros. is a video game movie that is memorable in the way that may surprise you. The witty dialogue and rapport between Bob Hoskins and John Leguizamo as Mario and Luigi"
"2","Minnehaha","One of the worst movies ever made!","OK"
"3","Appleton","A misunderstood and fun film.","Not much I can say except that this movie is often riffed on for all the wrong reasons.Yes"
"1","Altoona","Could have been better!","I am a big fan of the Super Mario Brothers - the video game and the TV show. I had high hope for this movie"
"4","Ridgewood","good"," Its GOOOOOOOOOOOOOOOD!!(Jim Carrey voice)"
"3","Lake Elmo","flawed concept","Here's my problem: While I do think we create a lot of our own problems in this life"
"3","Redland","Pity the Fool who Don't Buy This","The best part about the A-Team (besides no one getting hurt"
"2","Macomb","Rosemary's Baby","This dvd came from England & would not play on my player so I have returned it & I am waiting on a credit. I would not have ordered this had I know it was coming from England & that I might have a problem"
"4","Norco","I loved everything about this movie","The acting is fantastic. Direction outstanding. Chilling in every sense of the word. I love this movie! One of my top ten."
"5","Jackson","A Face Only A Mother Could Love !!","Yes"
"5","Eustis","Michael sings the classics","These are the best-known hits from the best-loved shows -- the songs you go home humming -- and Michael's gorgeous and evocative voice really delivers the goods. Love this tour of great moments on stage."
"4","Indio","Unbelieveable video and interesting stories","Unlike most of the reviews here"
"1","Prairieville","Wish I had read the reviews ...","These videos are fantastic from a documentary perspective"
"2","Egypt Lake-Leto","Disappointed","I only wish that more time was devoted to the natural beauty of Italy and its cities"
"2","Salida","FIRMWARE FIXED IT","I just updated to the newest firmware (1.5 4/12/2007) and the disc is now PLAYABLE in my XA2. Big relieve for all I hope. Review of the source to follow."
"3","Bedford","Does not work.","Read the reviews about this disk not working. Figured they were old reviews and had fixed the problems. Very disappointed in that they are still selling this defective disk. Brand new XBox HD DVD player refuses to boot with this."
"4","Rochester","Good CD Player"," but third-rate headphones."
"3","Jacksonville","Detailed"," but not to much."
"4","North Strabane","A SEA AND SURVIVAL STORY OF EPIC PROPORTIONS","This true story takes place in the early to middle 1800's and its location on Nantucket Island and in the middle of nowhere..asea. You learn that looking for whales is a group effort and when one is found"
"5","Tuscumbia","Riveting Story of Survival (and Death) at Sea","This is one of my favorite books of all time. The shocking sinking of the Essex (the inspiration for Moby Dick) is only the beginning of what the author turns into a gut-wrenching tale of a handful of sailors desperately trying to stave off starvation"
"5","Cambridge","Inside the Whalers","Philbrick takes the reader on a journey like no other"
"5","Clinton","great historical account of good and bad leadership","a bare facts historical account of the sinking of the Essex by a sperm whale and the enfolding events after that. The failure of the captain led to unnecessary loss of life when he gave in to his first mate's influence to sail east in the small whaleboats"
"5","Alden","What a wonderful Story","What a wonderful and often time touching story. It is very hard to believe what those men went thru. They were dealt one bad card after another and yet they still endured. I recommend this book to everyone. Especially those who think that they have is bad."
"4","Massena","In the Heart of the Sea: The Tragedy of the Whaleship Essex.","The condition is somewhat less than perfect -- but not much.The book is wonderful. Fascinating story and Very well researched and written."
"3","Cross Lanes","The sinking of the whale ship Essex","This book is a wonderful story of the lives of the sailors on the whaling ships of the period. Their adventure on the ship Essex as it left port sailing for new grounds . Little was know about the islands of the Pacific and in thisstory it was a sad effect that could have made their rescue shorter and saved some lives. Some parts of the story even though it was factual was too much detail in the death of some of the ship mates.Their lives"
"3","Highland City","How does this novel stack up with the Penguin Version?","I haven't read this book"
"4","Hybla Valley","An Exciting Tale of Survival","The sinking of the Essex by a whale is probably most famous as the inspiration for Herman Melville's Moby Dick but in In the Heart of the Sea (The Tragedy of the Whaleship Essex) by Nathaniel Philbrick"
"4","Tucker","Poetry with a knack for memorable imagery.","Paul Hoover is an experienced and successful poet having published six earlier books of award winning poetry. Totem And Shadow: New and Selected Poems continues to document his impressive talent wedded to an innate knack for memorable imagery. After Miss Graven's Remarks: Boy"
"1","Richmond","Not the real thing","I couldn't believe my eyes when I saw the amazingly low price for this product. I guess I got what I paid for since these pills did not work at all. The ingredients list the same as Phazyme but offered no relief."
"4","New Philadelphia","A sports world comedy sporting two wonderful stars","Hepburn and Tracy at their finest in the story of a female athlete and her shady agent. An agent who turns out to be a good guy when he finds the right woman in the guise of Hepburn. Hepburn got to display her range of athletic skills in this film alongside some of the great female golfers and men and women tennis stars of the 1950's.Great film."
"3","Glasgow","Yuck","I must respectfully disagree with the 5 star rating for this CD. The reason being is that I have never heard such muck up of Vivaldi's Four Seasons. I have to admit I bought this CD purely for Piazzolla's 4 Seasons and now I am convinced that I definitely must search for a different performance of it"
"3","New Franklin","Still a Mystery","Anybody who is interested in learning about the beauty of Sufism should not turn to this book. This book"
"4","Homewood","Great book","Very good book. Quick read"
"3","Calimesa","Works great! love it!","I was able to easily search for a wireless network and set up my Tivo to my wireless internet! Works flawlessly!"
"4","Dunedin","TiVo wireless adapter","If you can't connect your TiVo using an Ethernet cord then this is the next best thing. This is the only wireless adapter that you should using if you own a TiVo. This adapter was specifically design for TiVo."
"4","Visalia","Tivo Wireless Adapter","Making Tivo apart of my wireless network was easy to do and now I can watch what is on either Tivo no matter which room I am in."
"4","Oak Grove","Great Buy","Bought this item for half or what a local computer store wanted. Worked right out of the box. Very good product."
"4","Daphne","TiVo wireless adaptor","Quick to ship and arrive"
"5","Shenandoah","Works as it should","Got it"
"5","Owego","Tivo wireless adapter","Great product"
"2","Oceanside","not too compatible with iMac","the set-up requirement for the Tivo wireless connector to my Apple wireless network would require me to change the setup of all the other components on my network. When Tivo worked on the network"
"3","Pleasant Hill","wasted my money","I spent an entire afternoon trying to get this piece of junk to talk to my wireless network. Went through the steps a bazillion times . It found my network and could not get an IP address ( after WEP key entered). Customer service were on the phone with me for hours and I think it safe to say we tried everything. Their final suggestion was call your ISP (Comcast) who were unable to help.So - I bought a new Tivo specifically to use on my network so I could broadcast my MP3 collection through my AV system and cant. Add to the fact thatthe new Tivo is giving problems switching channels and you can see what a giant step backwards I took - If I could give this zero stars I would!"
"4","Lansing","Wireless is the way to go!","This little gizmo works as promised. It's great if you want to transfer shows from one TV to another in your house. You can also download programs to your laptop providing you have TiVo to Go Plus. I'll never get stuck with another clunker of a movie on an airplane again.It took me a little time to figure out that in the setting up stage of connecting your adapter"
"3","Amarillo","Works.","Easy installation. Tivo has a rating of reception"
"4","Jasper","It works","This wireless adapter is the only one that worked right for my Tivo. I had bought one at Radio Shack of a different brand and it did not work at all. But the TiVo Adapter was easy to plug in and set up. I have been able to watch online movies through netflix and now I don't need to plug in the ethernet cord to the modem/router."
"3","Mason","Real Plug and Play","Plugged it in and my Series 2 DT popped up a config screen"
"4","Washington Terrace","It works","Not too much to say about this adapter. It does what it's supposed to. Sure an N adapter would be better but even the G is over priced."
"3","Calumet City","Great product!","Easy to setup without having to read the manual (haha) and works great without having to worry about compatibility problems."
"5","Queensbury","Works perfectly and a great price.","Short and sweet. Had it working flawlessly for 2 weeks now. No problems at all."
"4","Ashland","Great price and works perfect","I paid less and got the exact same Tivo wireless adapter as sold by Tivo. I have had no problems and now I get updates and download shows to my computer without any cables.."
"4","Dix Hills","Tivo Wirelss G","Ordered on same day as Tivo but came 8 - 10 days later. Caused a delay in hooking up. It would helpful to ensure shipping at the same time"
"3","Clay","Works with my Pioneer DVR-810H","I had purchased another wireless network adapter that wouldn't work for my DVR (approx. 4+ yrs old now). This TiVo adapter connected and works great. Saved a lot of cash too by purchasing through Amazon instead of TiVo directly..."
"1","Independence","Died 12/29/09 purchased 3/2007","I have 4 Tivo's in the house and each uses a different type of WiFi adaptor. I bought the Tivo AG0100 to connect my Series 2 to my Linksys Router in 2007 to replace a Linksys adaptor to get better speed. Never got the faster speed but it worked fine for 2 1/2 years and died suddenly. I giving two stars because it did not last very long. The other WiFi adaptors (Linksys and Microsoft) are still working and they are older. I do want to note that the Tivo WiFi adaptor runs hot"
"5","Huntington Park","Great product and easy to use!","We unpacked this small module"
"5","Woodburn","I like Hardy"," but I loved the Mayor"
"5","Westland","I liked this book.","At first"
"2","Elmwood Park","Dubious creation","There is already a book very similar to this one about a dog's adventure in Paris. Findley took credit"
"3","Flower Hill","Hard questions....Real Answers","This book asks some hard questions in the way it scrutinizes the bible. Reverend Teel then answers the questions in a way that makes sense and gives a real understanding of the possibilities. The book asks the reader to set aside all preconceived notions on religion"
"3","Shawnee","Snooz-a-pa-looza","Total waste of celluloid"
"2","North Canton","horrible!!!","I have to say that I am a pretty big Kurt fan. I was excited when this movie came out because I felt it might actually be pretty good. The only good thing I can say about this movie was that the actor looked semi-like Kurt"
"2","Cedar Hills","Worst.movie.ever.","Absolute worst movie that I have ever seen"
"1","Port Townsend","What a waste!","Unfortunately this is supposed to be inspiration for the last days of Kurt Cobains life. Leave it to this jackass who sold out to everything Kurt Cobain wasn't. Let alone this story was told from someone whom never met the man. Merely this movie was from someone who watched The Doors too many times. What a waste"
"2","Swissvale","Dissapointed...","I caught this movie a while ago while it was playing still playing at the theater. I was very saddened by how dissapointing it turned out to be. I'm sorry"
"2","Pineville","Difficult Read","This story is one of the most difficult stories I have read thus far. I am supposed to summarize the story for an English Majors course; but because the sentences are so long and tangled"
"3","Centerville","An Insult to the English Language","I just finshed reading it for my sophomore honors class"
"1","Scottsdale","Don't waste your money - buy 3rd edition used.","The back cover states Thoroughly updated for it's Fourth Edition. Not true. The only difference between this and the 3rd edition is that the three Clinical Problem sets at the back of the 3rd edition (pages 347-383) have been replaced by a set of additional questions called the Maintenance of Certification Primer (pages 345-375). In the first 345 pages there may be a few questions that have changed between the 2 editions but I haven't found one yet - even chapter 7"
"1","Pineville","Great for Novices who want to stay that way","Elaine and Peter are career authors. They obviously don't use the products they write about"
"2","Florin","Expected more...","not as good as Celtic Woman or Hanley Westenra ... I would say not half good. I can say they have great talent"
"4","Mack","High Energy Performance","These women ROCK! This is a wonderful performance by 4 very talented string musicians. It is impossible to watch this video and not start dancing"
"5","Bayou Cane","Didn't quite live up to expectations"," but still enjoyable"
"2","Stillwater","Useless for Home theatre or TV show.","This product is good for UK only. To play in USA you need to find a DVD player which has capability for changing Region Code to UK and that you may be able to do it on computer but not on DVD player in USA. I order it in USA"
"3","Machesney Park","Wonderful Techniques!","I am now a devoted Jean Warren fan! 1-2-3 Math is great for the under 5 set! I have two children"
"5","Pottstown","Solid overall","Helmut Rilling does well with large scale works of Bach"
"5","Burlingame","Excellent Service","I order the water shoes and was very pleased with my purchase. It is excatly what I wanted and I got it in no time flat. I was a little hesitant about ordering on line but this experience was well worth it.."
"4","Accokeek","Well made"," but runs a little small"
"2","Tuscaloosa","used to be good","I have lots of these "
"1","New Baltimore","Wrong size","I have no idea how good or bad this item is. Amazon advertised size M for this item and I ordered it. When it came it was S. and I didn't know it until after my grandson brought it back saying it was the wrong size. When I looked it was a S. I had thrown all the papers away so I am stuck with a size small for the next yard sale I have or someone has."
"5","Springfield","Works as Advertised","No complaints for wicking abilities and chafing prevention. Just make sure you pull down the cuffs before you start running otherwise your area may be irritated by the bunching of this and your underwear. Once you remember to do that"
"2","McDonough","Dumping it down the drain","This product obviously works well for most but it made my twins extremely fussy"
"1","Evans","Original poem not used"," images were of modern players"
